{
  "id": "zotquery-full-research-vnext",
  "name": "ZotQuery 全量研究输出 vNext",
  "version": "2.0.0",
  "layout": "structured-vnext",
  "sections": [
    "status",
    "summary",
    "identity",
    "queryContract",
    "corpusHealth",
    "funnel",
    "coverageGate",
    "evidenceSlots",
    "candidateAudit",
    "evidenceUnits",
    "facts",
    "claims",
    "conflicts",
    "gaps",
    "references",
    "audit",
    "machineAppendix"
  ]
}
